<?xml version="1.0" encoding="UTF-8"?>
<xs:schema xmlns:xs="http://www.w3.org/2001/XMLSchema">
  <xs:element name="pedido">
    <xs:complexType>
      <xs:sequence>
        <xs:element name="sucursal">
          <xs:complexType>
            <xs:sequence>
              <xs:element name="codigo" type="xs:string" fixed="8"/>
              <xs:element name="nombreTrabajador" type="xs:string"/>
              <xs:element name="fecha" type="xs:date"/>
              <xs:element name="observaciones" type="xs:string" minOccurs="0"/>
            </xs:sequence>
          </xs:complexType>
        </xs:element>
        <xs:element name="articulo" maxOccurs="unbounded">
          <xs:complexType>
            <xs:sequence>
              <xs:element name="codigo" type="xs:string"/>
              <xs:element name="unidades" type="xs:integer"/>
              <xs:element name="precio" type="xs:float"/>
              <xs:element name="observaciones" type="xs:string" minOccurs="0"/>
              <xs:element name="plazoRevision" type="xs:integer"/>
            </xs:sequence>
          </xs:complexType>
        </xs:element>
      </xs:sequence>
    </xs:complexType>
  </xs:element>
</xs:schema>